{
  "$schema": "https://json-schema.org/draft/2020-12/schema",
  "$id": "https://nexus.local/schemas/tool.schema.json",
  "title": "Nexus tool declaration",
  "description": "Schema for *.tool.json files consumed by codegen/generate.py. Each file declares one LLM-facing tool: identity, inputs, and per-provider variance. The C++ category class and method are inferred from the file path (parent folder = class in PascalCase, filename = method as Run<Name>OnUI). Tools always run synchronously on the UI sequence — there is no thread-selection field; a tool that needs blocking work hops it to base::ThreadPool inside its body (see tools/file_tool/file_tool.cc).",
  "type": "object",
  "additionalProperties": false,
  "required": ["name", "description", "inputs"],

  "properties": {
    "$schema": {
      "type": "string",
      "description": "Editor hint pointing at this file. Allows VS Code / similar editors to validate the document on save."
    },

    "name": {
      "type": "string",
      "pattern": "^[a-z][a-z0-9_]*$",
      "description": "On-disk tool identifier. snake_case. Drives the filename (without .tool.json), the C++ method name (Run<PascalCase(name)>OnUI), and the generated header (<name>.gen.h). By default it is also the LLM-facing tool name on the wire — set `wire_name` to override that one axis without renaming the file or the C++ method."
    },

    "wire_name": {
      "type": "string",
      "pattern": "^[A-Za-z][A-Za-z0-9_]*$",
      "description": "Optional override for the LLM-facing tool name. When omitted, the wire name equals `name`. Use to expose a PascalCase tool name to the model (e.g. wire_name='Read' for Claude-Code parity) while keeping the on-disk identifier lowercase. Only the schema's `name` field changes — codegen artifacts and dispatcher names continue to derive from `name`."
    },

    "description": {
      "type": "string",
      "minLength": 1,
      "description": "Human/LLM-facing description. Shipped on the tool definition; the LLM reads this to decide when to call the tool. Keep concise — long prose belongs in the skill instructions, not here."
    },

    "skill": {
      "type": "string",
      "pattern": "^[a-z][a-z0-9_]*$",
      "description": "Skill scope. Tools share the same `skill` value belong to the same skill bucket and activate together when Skill('<name>') fires. Omit (or set to 'always_on') for tools that should be available without skill activation."
    },

    "concurrencySafe": {
      "type": "boolean",
      "default": false,
      "description": "When true, the JS runtime may execute this tool concurrently with adjacent tool_use blocks from the same assistant response. Set only for tools that are explicitly safe to overlap. Do not infer this from read-only status: browser observation tools are read-like but must remain one-per-turn."
    },

    "inputs": {
      "type": "array",
      "description": "Ordered list of tool inputs. Order drives the C++ struct field order and the JSON-Schema 'required' list.",
      "items": {
        "type": "object",
        "additionalProperties": false,
        "required": ["name", "type"],
        "properties": {
          "name": {
            "type": "string",
            "pattern": "^[a-z][a-z0-9_]*$",
            "description": "C++ field name. snake_case. Becomes the generated struct field name. By default it is also the JSON-Schema property key — set `wire_name` to expose a different model-facing key (for example Grep's CC-compatible '-A')."
          },
          "wire_name": {
            "type": "string",
            "pattern": "^[A-Za-z0-9_-]+$",
            "description": "Optional model-facing JSON property key. When omitted, the wire name equals `name`. Use only when CC parity requires a non-C++ identifier such as '-A', '-B', '-C', '-n', or '-i'. Runtime extraction reads this key; generated C++ continues to use `name`."
          },
          "type": {
            "type": "string",
            "enum": [
              "string", "integer", "number", "boolean",
              "array<string>", "array<integer>", "array<number>", "array<object>",
              "object"
            ],
            "description": "Type. Mirrors `JsonSchemaKind` in nexus_tool_schema.h."
          },
          "required": {
            "type": "boolean",
            "default": false,
            "description": "When true, the field is added to the JSON-Schema `required` list AND the C++ struct uses the bare type. When false (default), the C++ struct wraps the field in std::optional<T>."
          },
          "internal": {
            "type": "boolean",
            "default": false,
            "description": "When true, the field stays in the C++ input struct AND the Extract() parser (so the host / runtime / hook-runner can populate it across the bridge) but is OMITTED from the model-facing schema — both `schema.parameters` and the PopulateRegistry tool-catalog builder. Use for host-set transport fields the model must never fill, e.g. the hook-runner's hook_shell/hook_stdin/hook_env or a runtime-injected per-call cwd. Mutually exclusive with `required`. Mirrors Claude Code's BashTool, which keeps `_simulatedSedEdit` in the input type but omits it from the schema sent to the model. NOTE: a hand-crafted `parametersStrict` block is emitted verbatim, so also remove any internal field from its `properties` and `required`."
          },
          "description": {
            "type": "string",
            "description": "Per-input description. Surfaced on the JSON-Schema property. The LLM reads this to fill in the field correctly."
          },
          "shape": {
            "type": "object",
            "description": "Optional advanced shape declaration for object / array<object> types. Currently supports discriminated-union variants for tools that genuinely need anyOf (rare).",
            "additionalProperties": false,
            "properties": {
              "discriminator": {
                "type": "string",
                "pattern": "^[a-z][a-z0-9_]*$",
                "description": "Field name on each variant that identifies the variant kind."
              },
              "variants": {
                "type": "array",
                "minItems": 1,
                "items": {
                  "type": "string",
                  "pattern": "^[a-z][a-z0-9_]*$"
                },
                "description": "Names of dedicated variant *.tool.json files (in a sibling 'variants/' subdirectory) that declare the per-variant shapes."
              }
            },
            "required": ["discriminator", "variants"]
          }
        }
      }
    },

    "output_kind": {
      "type": "string",
      "enum": ["string", "integer", "number", "boolean", "array", "object", "any"],
      "default": "object",
      "description": "Informational. Hints at the shape of the tool's result. Currently not emitted on the wire (the LLM doesn't need it), but reserved for future structured-output support."
    },

    "parametersStrict": {
      "type": "object",
      "description": "Optional hand-crafted strict-mode JSON Schema variant. When present, codegen emits it into `schema.strict_input_schema`; the host manifest surfaces it as `parametersStrict` on the hosted-tool entry; the JS guest (`deps.ts::serializeToolsForModel`) selects this variant over the regular `parameters` block when the active model has `supportsStrictTools: true` in NEXUS_MODEL_CONFIG, AND sets the outbound `strict: true` flag on the tool definition. Authors must keep this strict-compliant: `additionalProperties: false` on every nested object, no `pattern`/`format`/`maxItems`/`minItems`/`maxLength`/`minLength`. Strict schemas must list every property key in `required`; model-optional fields are represented as nullable-required, e.g. `\"type\": [\"string\", \"null\"]`, while Extract() treats null as unset.",
      "properties": {
        "type": { "type": "string", "enum": ["object"] }
      },
      "required": ["type"]
    },

    "providers": {
      "type": "object",
      "description": "Per-provider variance. Each block is OPTIONAL; missing means the provider takes defaults.",
      "additionalProperties": {
        "type": "object",
        "additionalProperties": false,
        "properties": {
          "strict": {
            "type": "boolean",
            "default": false,
            "description": "Opt into provider-side grammar-constrained sampling (Anthropic 'Strict tool use', OpenAI 'Structured Outputs'). Only set true when the tool's schema is provider-strict-compliant: additionalProperties:false on every nested object, no maxItems/minItems/pattern/format."
          },
          "input_examples": {
            "type": "array",
            "description": "Optional canonical example calls. Surfaced on the wire as Anthropic's `input_examples` (other providers silently drop). Each entry must validate against the tool's `inputs` schema; Anthropic returns 400 on any violation.",
            "items": {
              "type": "object"
            }
          }
        }
      }
    },

    "prompt": {
      "type": "object",
      "additionalProperties": false,
      "required": ["section", "line"],
      "description": "Optional per-tool prompt-section content. When present, codegen emits an entry into `prompt_tool_entries.gen.h` consumed by `api/catalog/prompt_section_renderer.cc` to compose the `{{TOOL_CATALOG}}` placeholder content. Tools without a `prompt` block are silently skipped — they remain available on the wire but aren't advertised in the system prompt. Replaces the hand-maintained per-tool prose that pre-Phase-12 lived as constexpr blocks in C++ + a parallel BROWSER_TOOL_NAMES set in TS.",
      "properties": {
        "section": {
          "type": "string",
          "enum": [
            "browser-tools",
            "file-shell-tools",
            "task-tracking",
            "skills"
          ],
          "description": "Which section of the system prompt this tool surfaces in. The renderer composes sections in the order browser-tools → file-shell-tools → task-tracking → skills → parallelism (parallelism is always emitted from a static C++ trailer)."
        },
        "group": {
          "type": "string",
          "minLength": 1,
          "description": "Optional sub-group label within a section. Browser-tools sub-groups today: 'Navigation' / 'Element interaction' / 'Search' / 'Media' / 'Observation' / 'Termination'. Other sections currently don't subdivide and should omit this field."
        },
        "line": {
          "type": "string",
          "minLength": 1,
          "description": "The bullet line shown to the LLM. One or two short sentences naming the tool's signature and intended usage. The renderer prefixes a single '- ' bullet marker — do not include it in the line itself."
        }
      }
    }
  }
}
