{
  "$schema": "../../codegen/tool_schema.json",
  "name": "select",
  "wire_name": "BrowserSelectOption",
  "description": "Pick an option from a native <select> element on the active tab. The `value` must match one of the <option>'s `value` attributes exactly (case-sensitive). For non-native combobox widgets (custom dropdown UI) use `BrowserClick` to expand the menu, then `BrowserClick` again on the desired option.",
  "skill": "browser",
  "inputs": [
    {
      "name": "index",
      "type": "integer",
      "required": true,
      "description": "Required element index of the <select>, from the latest observation's elements[] list."
    },
    {
      "name": "value",
      "type": "string",
      "required": true,
      "description": "Required option value (the <option>'s `value` attribute, not its visible text)."
    }
  ],
  "output_kind": "object",
  "providers": {
    "anthropic": {
      "input_examples": [
        {
          "index": 18,
          "value": "us"
        }
      ]
    }
  }
}
