{
  "$schema": "../../codegen/tool_schema.json",
  "name": "evaluate",
  "wire_name": "BrowserEvaluate",
  "description": "Execute JavaScript in the active tab's main world via CDP Runtime.evaluate (awaitPromise=true, returnByValue=true). Returns the JSON-stringified return value, capped at ~20k chars. Disabled by default — the user must opt in via Settings · Tools because the surface has same-origin access (cookies, fetch, localStorage). Use for: ARIA-only widgets the structured observation didn't surface, inspecting page-side state (React/Redux/window globals), gestures (custom drag/hover events) the structured actions can't express. Best practice: wrap in an IIFE — `(() => { try { /* ... */ return value; } catch (e) { return { error: String(e) }; } })()` — and only call browser APIs (document, window, DOM). Async IIFEs are awaited.",
  "skill": "browser",
  "inputs": [
    {
      "name": "code",
      "type": "string",
      "required": true,
      "description": "JavaScript expression or statement to evaluate. The value of the last expression is returned. For multi-statement or async code, wrap in an IIFE that returns the value you want — e.g. `(async () => { const r = await fetch('/x'); return r.status; })()`. Errors thrown inside the IIFE are caught and returned as `{ error: '...' }`."
    }
  ],
  "output_kind": "object",
  "providers": {
    "anthropic": {
      "input_examples": [
        {
          "code": "(() => [...document.querySelectorAll('li[role=\"option\"]')].map(el => ({ id: el.id, text: el.textContent.trim() })))()"
        },
        {
          "code": "(() => ({ url: location.href, title: document.title, ready: document.readyState }))()"
        },
        {
          "code": "(async () => { const r = await fetch('/api/status'); return { ok: r.ok, code: r.status }; })()"
        }
      ]
    }
  }
}
