{
  "$schema": "../../codegen/tool_schema.json",
  "name": "edit",
  "wire_name": "Edit",
  "description": "Performs exact string replacements in files.\n\nUsage:\n- You must use your `Read` tool at least once in the conversation before editing. This tool will error if you attempt an edit without reading the file.\n- When editing text from Read tool output, ensure you preserve the exact indentation (tabs/spaces) as it appears AFTER the line number prefix. The line number prefix format is: line number + tab. Everything after that is the actual file content to match. Never include any part of the line number prefix in the old_string or new_string.\n- ALWAYS prefer editing existing files in the codebase. NEVER write new files unless explicitly required.\n- Only use emojis if the user explicitly requests it. Avoid adding emojis to files unless asked.\n- The edit will FAIL if `old_string` is not unique in the file. Either provide a larger string with more surrounding context to make it unique or use `replace_all` to change every instance of `old_string`.\n- Use `replace_all` for replacing and renaming strings across the file. This parameter is useful if you want to rename a variable for instance.",
  "inputs": [
    {
      "name": "file_path",
      "type": "string",
      "required": true,
      "description": "The absolute path to the file to modify"
    },
    {
      "name": "old_string",
      "type": "string",
      "required": true,
      "description": "The text to replace"
    },
    {
      "name": "new_string",
      "type": "string",
      "required": true,
      "description": "The text to replace it with (must be different from old_string)"
    },
    {
      "name": "replace_all",
      "type": "boolean",
      "required": false,
      "description": "Replace all occurrences of old_string (default false)"
    }
  ],
  "parametersStrict": {
    "type": "object",
    "properties": {
      "file_path": {
        "type": "string",
        "description": "The absolute path to the file to modify"
      },
      "old_string": {
        "type": "string",
        "description": "The text to replace"
      },
      "new_string": {
        "type": "string",
        "description": "The text to replace it with (must be different from old_string)"
      },
      "replace_all": {
        "type": ["boolean", "null"],
        "description": "Replace all occurrences of old_string (default false)"
      }
    },
    "required": ["file_path", "old_string", "new_string", "replace_all"],
    "additionalProperties": false
  },
  "output_kind": "object"
}
