{
  "$schema": "../../codegen/tool_schema.json",
  "name": "read_element",
  "wire_name": "BrowserReadElement",
  "description": "Get the visible text inside one element on the active tab. Use when the observation's element label is truncated, or when you need the full body of a paragraph/article block. For page-wide search use `BrowserFindText` instead. Response is capped server-side.",
  "skill": "browser",
  "inputs": [
    {
      "name": "index",
      "type": "integer",
      "required": true,
      "description": "Required element index from the latest observation's elements[] list."
    }
  ],
  "output_kind": "object",
  "providers": {
    "anthropic": {
      "input_examples": [
        {
          "index": 12
        }
      ]
    }
  }
}
