{
  "$schema": "../../codegen/tool_schema.json",
  "name": "media_control",
  "wire_name": "BrowserMediaControl",
  "description": "Control playback on the active tab's MediaSession. action='play' resumes, 'pause' halts, 'seek' jumps to seek_time_ms (an absolute position in milliseconds from the start of the media). Quietly no-ops on pages without an active MediaSession (most YouTube / Vimeo / Spotify-style players register one; static pages do not).",
  "skill": "browser",
  "inputs": [
    {
      "name": "action",
      "type": "string",
      "required": true,
      "description": "One of: 'play', 'pause', 'seek'. 'seek' additionally requires seek_time_ms."
    },
    {
      "name": "seek_time_ms",
      "type": "integer",
      "required": false,
      "description": "Required when action='seek'. Absolute target position in milliseconds from the start of the media (e.g. 90000 jumps to 1m30s in)."
    }
  ],
  "output_kind": "object",
  "providers": {
    "anthropic": {
      "input_examples": [
        {
          "action": "play"
        },
        {
          "action": "pause"
        },
        {
          "action": "seek",
          "seek_time_ms": 90000
        }
      ]
    }
  }
}
