{
  "$schema": "../../codegen/tool_schema.json",
  "name": "scroll",
  "wire_name": "BrowserScroll",
  "description": "Scroll the active tab's viewport in a direction by N viewport-units (1.0 = one full page). Pass an element index to scroll INSIDE that element instead of the viewport.",
  "skill": "browser",
  "inputs": [
    {
      "name": "direction",
      "type": "string",
      "required": true,
      "description": "Required scroll direction: 'up', 'down', 'left', or 'right'."
    },
    {
      "name": "amount",
      "type": "number",
      "required": false,
      "description": "How far to scroll, in viewport-units. Default 1.0 (one full page). Use 0.5 for half a page, 2.0 for two pages."
    },
    {
      "name": "index",
      "type": "integer",
      "required": false,
      "description": "Optional element index to scroll INSIDE (instead of scrolling the viewport). The element must be a scrollable container from the latest observation's elements[]. OMIT THIS FIELD ENTIRELY to scroll the page viewport — do NOT pass 0 or any placeholder, since 0 isn't a valid element index and will be rejected. Only set this when you specifically need to scroll inside a nested scrollable region (e.g. a modal's overflow list)."
    }
  ],
  "output_kind": "object",
  "providers": {
    "anthropic": {
      "input_examples": [
        {
          "direction": "down"
        },
        {
          "direction": "up",
          "amount": 0.5
        },
        {
          "direction": "down",
          "amount": 2.0,
          "index": 12
        }
      ]
    }
  }
}
