{
  "$schema": "../../codegen/tool_schema.json",
  "name": "bash",
  "wire_name": "Bash",
  "description": "Executes a given bash command and returns its output.\n\nThe working directory persists between commands, but shell state does not. The shell environment is initialized from the user's profile (bash or zsh).\n\nIMPORTANT: Avoid using this tool to run `find`, `grep`, `cat`, `head`, `tail`, `sed`, `awk`, or `echo` commands, unless explicitly instructed or after you have verified that a dedicated tool cannot accomplish your task. Instead, use the appropriate dedicated tool as this will provide a much better experience for the user:\n\n - File search: Use Glob (NOT find or ls)\n - Content search: Use Grep (NOT grep or rg)\n - Read files: Use Read (NOT cat/head/tail)\n - Edit files: Use Edit (NOT sed/awk)\n - Write files: Use Write (NOT echo >/cat <<EOF)\n - Communication: Output text directly (NOT echo/printf)\nWhile the Bash tool can do similar things, it's better to use the built-in tools as they provide a better user experience and make it easier to review tool calls and give permission.\n\n# Instructions\n - If your command will create new directories or files, first use this tool to run `ls` to verify the parent directory exists and is the correct location.\n - Always quote file paths that contain spaces with double quotes in your command (e.g., cd \"path with spaces/file.txt\")\n - Try to maintain your current working directory throughout the session by using absolute paths and avoiding usage of `cd`. You may use `cd` if the User explicitly requests it.\n - You may specify an optional timeout in milliseconds (up to 600000ms / 10 minutes). By default, your command will timeout after 120000ms (2 minutes).\n - You can use the `run_in_background` parameter to run the command in the background. Only use this if you don't need the result immediately and are OK being notified when the command completes later. You do not need to check the output right away — you'll be notified when it finishes. You do not need to use '&' at the end of the command when using this parameter.\n - When issuing multiple commands:\n  - If the commands are independent and can run in parallel, make multiple Bash tool calls in a single message. Example: if you need to run \"git status\" and \"git diff\", send a single message with two Bash tool calls in parallel.\n  - If the commands depend on each other and must run sequentially, use a single Bash call with '&&' to chain them together.\n  - Use ';' only when you need to run commands sequentially but don't care if earlier commands fail.\n  - DO NOT use newlines to separate commands (newlines are ok in quoted strings).\n - For git commands:\n  - Prefer to create a new commit rather than amending an existing commit.\n  - Before running destructive operations (e.g., git reset --hard, git push --force, git checkout --), consider whether there is a safer alternative that achieves the same goal. Only use destructive operations when they are truly the best approach.\n  - Never skip hooks (--no-verify) or bypass signing (--no-gpg-sign, -c commit.gpgsign=false) unless the user has explicitly asked for it. If a hook fails, investigate and fix the underlying issue.\n - Avoid unnecessary `sleep` commands:\n  - Do not sleep between commands that can run immediately — just run them.\n  - If your command is long running and you would like to be notified when it finishes — use `run_in_background`. No sleep needed.\n  - Do not retry failing commands in a sleep loop — diagnose the root cause.\n  - If waiting for a background task you started with `run_in_background`, you will be notified when it completes — do not poll.\n  - If you must poll an external process, use a check command (e.g. `gh run view`) rather than sleeping first.\n  - If you must sleep, keep the duration short (1-5 seconds) to avoid blocking the user.",
  "inputs": [
    {
      "name": "command",
      "type": "string",
      "required": true,
      "description": "The command to execute"
    },
    {
      "name": "timeout",
      "type": "integer",
      "required": false,
      "description": "Optional timeout in milliseconds (max 600000)"
    },
    {
      "name": "description",
      "type": "string",
      "required": false,
      "description": "Clear, concise description of what this command does in active voice. Never use words like \"complex\" or \"risk\" in the description - just describe what it does.\n\nFor simple commands (git, npm, standard CLI tools), keep it brief (5-10 words):\n- ls → \"List files in current directory\"\n- git status → \"Show working tree status\"\n- npm install → \"Install package dependencies\"\n\nFor commands that are harder to parse at a glance (piped commands, obscure flags, etc.), add enough context to clarify what it does:\n- find . -name \"*.tmp\" -exec rm {} \\; → \"Find and delete all .tmp files recursively\"\n- git reset --hard origin/main → \"Discard all local changes and match remote main\"\n- curl -s url | jq '.data[]' → \"Fetch JSON from URL and extract data array elements\""
    },
    {
      "name": "run_in_background",
      "type": "boolean",
      "required": false,
      "description": "Set true to run the command in the background and return immediately with a shell_id instead of waiting for it to finish. Use this only when you don't need the result right away (long builds, servers, watchers). You will be notified when the command completes, so do not check the output right away or poll while it is running. The command is still bounded by `timeout`."
    },
    {
      "name": "hook_shell",
      "type": "string",
      "required": false,
      "internal": true,
      "description": "Host-set; hidden from the model. Used by the hook runner to run a command hook in an explicit shell (\"bash\" | \"sh\" | \"zsh\" | \"pwsh\" | \"powershell\") rather than the default cmd/sh wrapper, so hook input can be delivered on stdin with env exported natively."
    },
    {
      "name": "hook_stdin",
      "type": "string",
      "required": false,
      "internal": true,
      "description": "Host-set; hidden from the model. JSON written to the command's stdin (the hook-input contract). Only honored together with hook_shell."
    },
    {
      "name": "hook_env",
      "type": "string",
      "required": false,
      "internal": true,
      "description": "Host-set; hidden from the model. JSON object of environment variables (e.g. CLAUDE_PROJECT_DIR, CLAUDE_PLUGIN_ROOT) exported for the command hook. Only honored together with hook_shell."
    },
    {
      "name": "cwd",
      "type": "string",
      "required": false,
      "internal": true,
      "description": "Host-set; hidden from the model. Absolute working directory for this single command, injected by the runtime for a worktree-isolated subagent so parallel agents don't share one session cwd. When absent, the command runs in the session cwd (the default)."
    }
  ],
  "parametersStrict": {
    "type": "object",
    "properties": {
      "command": {
        "type": "string",
        "description": "The command to execute"
      },
      "timeout": {
        "type": ["integer", "null"],
        "description": "Optional timeout in milliseconds (max 600000)"
      },
      "description": {
        "type": ["string", "null"],
        "description": "Clear, concise description of what this command does in active voice. Never use words like \"complex\" or \"risk\" in the description - just describe what it does.\n\nFor simple commands (git, npm, standard CLI tools), keep it brief (5-10 words):\n- ls → \"List files in current directory\"\n- git status → \"Show working tree status\"\n- npm install → \"Install package dependencies\"\n\nFor commands that are harder to parse at a glance (piped commands, obscure flags, etc.), add enough context to clarify what it does:\n- find . -name \"*.tmp\" -exec rm {} \\; → \"Find and delete all .tmp files recursively\"\n- git reset --hard origin/main → \"Discard all local changes and match remote main\"\n- curl -s url | jq '.data[]' → \"Fetch JSON from URL and extract data array elements\""
      },
      "run_in_background": {
        "type": ["boolean", "null"],
        "description": "Set true to run the command in the background and return a shell_id immediately. You will be notified when the command completes; do not poll for output while it is running."
      }
    },
    "required": ["command", "timeout", "description", "run_in_background"],
    "additionalProperties": false
  },
  "output_kind": "object"
}
