{
  "$schema": "../../codegen/tool_schema.json",
  "name": "glob",
  "wire_name": "Glob",
  "concurrencySafe": true,
  "description": "- Fast file pattern matching tool that works with any codebase size\n- Supports glob patterns like \"**/*.js\" or \"src/**/*.ts\"\n- Returns matching file paths sorted by modification time\n- Use this tool when you need to find files by name patterns\n- When you are doing an open ended search that may require multiple rounds of globbing and grepping, use the Agent tool instead",
  "inputs": [
    {
      "name": "pattern",
      "type": "string",
      "required": true,
      "description": "The glob pattern to match files against"
    },
    {
      "name": "path",
      "type": "string",
      "required": false,
      "description": "The directory to search in. If not specified, the current working directory will be used. IMPORTANT: Omit this field to use the default directory. DO NOT enter \"undefined\" or \"null\" - simply omit it for the default behavior. Must be a valid directory path if provided."
    },
    {
      "name": "limit",
      "type": "integer",
      "required": false,
      "description": "Optional cap on returned paths. Defaults to 100."
    }
  ],
  "output_kind": "object"
}
